{
  "id": "economy:standard:4c117949e086de69a41c76fe632d8c9ae95d0f8a62d80f6149ae518dd8bcc00d",
  "metadata": {
    "content_sha256": "4c117949e086de69a41c76fe632d8c9ae95d0f8a62d80f6149ae518dd8bcc00d",
    "created_at_utc": "2026-07-15T21:08:07Z",
    "game": "poe1",
    "game_data_hash": "c459d0b9b774973ee165b8390dde226b5422b09b3250dda0b38feed16bdc0eba",
    "league_key": "standard",
    "league_name": "Standard",
    "low_confidence_keys": [
      "eldritch_ember:1",
      "eldritch_exalt",
      "eldritch_ichor:1",
      "eldritch_ichor:2",
      "essence:Metadata/Items/Currency/CurrencyEssenceDoubt5",
      "essence:Metadata/Items/Currency/CurrencyEssenceFear4",
      "essence:Metadata/Items/Currency/CurrencyEssenceGreed5",
      "essence:Metadata/Items/Currency/CurrencyEssenceTorment2",
      "essence:Metadata/Items/Currency/CurrencyEssenceTorment6",
      "fossil:Metadata/Items/Currency/CurrencyDelveCraftingCold",
      "fossil:Metadata/Items/Currency/CurrencyDelveCraftingCorruptEssence",
      "fossil:Metadata/Items/Currency/CurrencyDelveCraftingElemental",
      "fossil:Metadata/Items/Currency/CurrencyDelveCraftingFire",
      "resonator:2",
      "resonator:3"
    ],
    "missing_keys": [
      "alchemy",
      "alteration",
      "annul",
      "augment",
      "base",
      "bench:CraftedTravelSkillsCannotBeExerted",
      "bench:EinharMasterAccuracyRating1",
      "bench:EinharMasterAccuracyRating2_",
      "bench:EinharMasterAddedChaosDamage1",
      "bench:EinharMasterAddedColdDamage1_",
      "bench:EinharMasterAddedColdDamage2",
      "bench:EinharMasterAddedColdDamageQuiver1__",
      "bench:EinharMasterAddedColdDamageQuiver2",
      "bench:EinharMasterAddedFireDamage1",
      "bench:EinharMasterAddedFireDamage2",
      "bench:EinharMasterAddedFireDamageQuiver1___",
      "bench:EinharMasterAddedFireDamageQuiver2",
      "bench:EinharMasterAddedLightningDamage1",
      "bench:EinharMasterAddedLightningDamage2",
      "bench:EinharMasterAddedLightningDamageQuiver1_",
      "bench:EinharMasterAddedLightningDamageQuiver2_",
      "bench:EinharMasterAddedPhysicalDamage1",
      "bench:EinharMasterAllAttributes1",
      "bench:EinharMasterAllAttributes2",
      "bench:EinharMasterAllResist1",
      "bench:EinharMasterAllResistMinionResist1_",
      "bench:EinharMasterArmourAndEnergyShieldPercent1",
      "bench:EinharMasterArmourAndEnergyShieldPercent2",
      "bench:EinharMasterArmourAndEvasionPercent1_",
      "bench:EinharMasterArmourAndEvasionPercent2",
      "bench:EinharMasterArmourPercent1_",
      "bench:EinharMasterArmourPercent2",
      "bench:EinharMasterAttackSpeedJewelry1",
      "bench:EinharMasterAvoidBleed1",
      "bench:EinharMasterAvoidStun1",
      "bench:EinharMasterAvoidStun2",
      "bench:EinharMasterChanceToSuppressSpells1_",
      "bench:EinharMasterChanceToSuppressSpellsHigh1",
      "bench:EinharMasterChaosDamage1",
      "bench:EinharMasterChaosDamage2",
      "bench:EinharMasterChaosDamagePrefix1",
      "bench:EinharMasterChaosDamagePrefix2",
      "bench:EinharMasterChaosDamagePrefix3",
      "bench:EinharMasterChaosDamageTwoHandPrefix1",
      "bench:EinharMasterChaosDamageTwoHandPrefix2",
      "bench:EinharMasterChaosDamageTwoHandPrefix3_",
      "bench:EinharMasterChaosResistanceToDamageOverTime1",
      "bench:EinharMasterColdAndLightningResist1_",
      "bench:EinharMasterColdAndLightningResist2",
      "bench:EinharMasterColdDamage1_",
      "bench:EinharMasterColdDamage2",
      "bench:EinharMasterColdDamagePrefix1",
      "bench:EinharMasterColdDamagePrefix2__",
      "bench:EinharMasterColdDamageTwoHandPrefix1",
      "bench:EinharMasterColdDamageTwoHandPrefix2",
      "bench:EinharMasterColdResist2",
      "bench:EinharMasterCriticalStrikeChanceSpells1",
      "bench:EinharMasterCriticalStrikeChanceSpells2h1",
      "bench:EinharMasterCriticalStrikeMultiplier1",
      "bench:EinharMasterCriticalStrikeMultiplier2",
      "bench:EinharMasterDegenerationDamage1_",
      "bench:EinharMasterDexterity2",
      "bench:EinharMasterEnergyShieldDelay1_",
      "bench:EinharMasterEnergyShieldPercent1",
      "bench:EinharMasterEnergyShieldPercent2",
      "bench:EinharMasterEnergyShieldRegeneration1___",
      "bench:EinharMasterEvasionAndEnergyShieldPercent1",
      "bench:EinharMasterEvasionAndEnergyShieldPercent2",
      "bench:EinharMasterEvasionPercent1",
      "bench:EinharMasterEvasionPercent2",
      "bench:EinharMasterFireAndColdResist1",
      "bench:EinharMasterFireAndColdResist2",
      "bench:EinharMasterFireAndLightningResist1",
      "bench:EinharMasterFireAndLightningResist2",
      "bench:EinharMasterFireDamage1",
      "bench:EinharMasterFireDamage2_",
      "bench:EinharMasterFireDamagePrefix1_",
      "bench:EinharMasterFireDamagePrefix2",
      "bench:EinharMasterFireDamageTwoHandPrefix1",
      "bench:EinharMasterFireDamageTwoHandPrefix2",
      "bench:EinharMasterFireResist2",
      "bench:EinharMasterFlaskEffectDuration1",
      "bench:EinharMasterFlaskEffectDuration2",
      "bench:EinharMasterFlatArmour1",
      "bench:EinharMasterFlatArmour2_",
      "bench:EinharMasterFlatEnergyShield1",
      "bench:EinharMasterFlatEnergyShield2",
      "bench:EinharMasterFlatEvasion1",
      "bench:EinharMasterFlatEvasion2",
      "bench:EinharMasterFlatLifeAndManaRegeneration1",
      "bench:EinharMasterGlobalCriticalStrikeChance1",
      "bench:EinharMasterIncreasedCastSpeed1",
      "bench:EinharMasterIncreasedCastSpeed3",
      "bench:EinharMasterIncreasedCastSpeedJewelry1",
      "bench:EinharMasterIncreasedCastSpeedTwoHand1",
      "bench:EinharMasterIncreasedCastSpeedTwoHand3_",
      "bench:EinharMasterIncreasedLife2",
      "bench:EinharMasterIncreasedLife3",
      "bench:EinharMasterIncreasedLife4",
      "bench:EinharMasterIncreasedMana1",
      "bench:EinharMasterIncreasedMana2",
      "bench:EinharMasterIncreasedManaRegenerationTwoHandWeapon1",
      "bench:EinharMasterIncreasedManaRegenerationTwoHandWeapon2",
      "bench:EinharMasterIncreasedManaTwoHandWeapon1___",
      "bench:EinharMasterIncreasedManaTwoHandWeapon2_",
      "bench:EinharMasterIncreasedManaWeapon1__",
      "bench:EinharMasterIncreasedManaWeapon2",
      "bench:EinharMasterIntelligence2__",
      "bench:EinharMasterLifeLeechFromAttacksPermyriadSuffix1",
      "bench:EinharMasterLifeLeechFromAttacksPermyriadSuffix2",
      "bench:EinharMasterLifeRegenerationRate1",
      "bench:EinharMasterLightningDamage1",
      "bench:EinharMasterLightningDamage2_",
      "bench:EinharMasterLightningDamagePrefix1",
      "bench:EinharMasterLightningDamagePrefix2",
      "bench:EinharMasterLightningDamageTwoHandPrefix1",
      "bench:EinharMasterLightningDamageTwoHandPrefix2",
      "bench:EinharMasterLightningResist2",
      "bench:EinharMasterLocalAccuracyRating1",
      "bench:EinharMasterLocalAccuracyRating2",
      "bench:EinharMasterLocalColdDamage1",
      "bench:EinharMasterLocalColdDamage2",
      "bench:EinharMasterLocalColdDamageTwoHand1",
      "bench:EinharMasterLocalColdDamageTwoHand2",
      "bench:EinharMasterLocalCriticalStrikeChance1_",
      "bench:EinharMasterLocalCriticalStrikeChance2",
      "bench:EinharMasterLocalFireDamage1",
      "bench:EinharMasterLocalFireDamage2",
      "bench:EinharMasterLocalFireDamageTwoHand1",
      "bench:EinharMasterLocalFireDamageTwoHand2",
      "bench:EinharMasterLocalIncreasedAttackSpeed1__",
      "bench:EinharMasterLocalIncreasedAttackSpeed3",
      "bench:EinharMasterLocalIncreasedAttackSpeedRanged3",
      "bench:EinharMasterLocalIncreasedBlockPercentage1",
      "bench:EinharMasterLocalIncreasedPhysicalDamage1",
      "bench:EinharMasterLocalIncreasedPhysicalDamage2_",
      "bench:EinharMasterLocalIncreasedPhysicalDamage4___",
      "bench:EinharMasterLocalLifeLeechPermyriadNewSuffix1",
      "bench:EinharMasterLocalLifeLeechPermyriadNewSuffix2",
      "bench:EinharMasterLocalLightningDamage1_",
      "bench:EinharMasterLocalLightningDamage2",
      "bench:EinharMasterLocalLightningDamageTwoHand1_",
      "bench:EinharMasterLocalLightningDamageTwoHand2",
      "bench:EinharMasterLocalManaLeechPermyriadNewSuffix1",
      "bench:EinharMasterLocalPhysicalDamage1",
      "bench:EinharMasterLocalPhysicalDamage2_",
      "bench:EinharMasterLocalPhysicalDamageTwoHand1",
      "bench:EinharMasterLocalPhysicalDamageTwoHand2",
      "bench:EinharMasterManaRegeneration1",
      "bench:EinharMasterManaRegeneration2",
      "bench:EinharMasterMaximumEnergyShield1_",
      "bench:EinharMasterMineDamageOnWeapon1h1",
      "bench:EinharMasterMineDamageOnWeapon2h1",
      "bench:EinharMasterMineLayingSpeed1",
      "bench:EinharMasterMineLayingSpeed2",
      "bench:EinharMasterMineLayingSpeed2h1",
      "bench:EinharMasterMineLayingSpeed2h2_",
      "bench:EinharMasterMinionDamageOnWeapon1h1",
      "bench:EinharMasterMinionDamageOnWeapon1h2",
      "bench:EinharMasterMinionDamageOnWeapon2h1_",
      "bench:EinharMasterMinionDamageOnWeapon2h2",
      "bench:EinharMasterMinionLife1",
      "bench:EinharMasterMinionLife2",
      "bench:EinharMasterMinionMovementSpeed1",
      "bench:EinharMasterMinionMovementSpeed2",
      "bench:EinharMasterMovementVelocity1",
      "bench:EinharMasterPhysicalDamage1_",
      "bench:EinharMasterPhysicalDamage2",
      "bench:EinharMasterReducedDamageOverTimeTaken1",
      "bench:EinharMasterReducedPhysicalDamageTaken1",
      "bench:EinharMasterReducedSelfChillEffect1",
      "bench:EinharMasterReducedSelfCurseEffect1",
      "bench:EinharMasterReducedSelfFreezeEffect1",
      "bench:EinharMasterReducedSelfIgniteDuration1",
      "bench:EinharMasterReducedSelfShockEffect1",
      "bench:EinharMasterSpellAddedColdDamage1",
      "bench:EinharMasterSpellAddedColdDamage2",